"doc_id","text","pol_account","id","date","context","issue","policy_flag","stance","annotator","annotated_at","selected_at","uncertainty","not_sentence","draft_flag","issue2","uncertainty2","stance2"
"text1591442.1","Rebellious Tory MPs plot Boris Johnson’s downfall from secret Westminster base - really Dave?","carolinenokes",1472486903714828288,"2021-12-19T08:40:09Z","Rebellious Tory MPs plot Boris Johnson’s downfall from secret Westminster base - really Dave? The “obscure” meeting place you’re most likely to find me and Karen is the tea room 😂😂 - not sure when we were supposedly discovered by a minister #didn’thappen https://t.co/eXCXgQHMJy",NA,NA,NA,NA,NA,NA,NA,NA,NA,NA,NA,NA
"text1277007.5","Let us decide 👇  🖥️ https://t.co/5NUnYN8h24 https://t.co/317lJ3JrTf","markjenkinsonmp",1583843127131254784,"2022-10-22T15:30:02Z","𝗖𝗼𝘂𝗹𝗱 𝘆𝗼𝘂 𝗯𝗲 𝗮 𝗖𝗮𝗺𝗽𝗮𝗶𝗴𝗻 𝗠𝗮𝗻𝗮𝗴𝗲𝗿?

Do you want to make a difference, helping to achieve big things in our local communities. 

There are few people more important than our Campaign Managers. 

Could it be you? Let us decide 👇

🖥️ https://t.co/5NUnYN8h24 https://t.co/317lJ3JrTf",NA,NA,NA,NA,NA,NA,NA,NA,NA,NA,NA,NA
"text437512.1","Some colleges are moving toward a model of continuous, lifelong learning in order to better prepare students for today’s economy, @jselingo reports:  https://t.co/kDa98ke1Lg","LordJimKnight",978440748038111232,"2018-03-27T01:17:07Z","Some colleges are moving toward a model of continuous, lifelong learning in order to better prepare students for today’s economy, @jselingo reports:  https://t.co/kDa98ke1Lg",NA,NA,NA,NA,NA,NA,NA,NA,NA,NA,NA,NA
"text1058828.3","It’s a real hub for the community so be sure to come by for a swim or an aquafit session. https://t.co/cRBeMr1BTL","RichardFoordLD",1635956829204217856,"2023-03-15T10:51:17Z","🏊🏻‍♂️ Great to stop by the Flamingo Pool in Axminster this morning. They’ve recently reopened after some urgent repair work, and I’m glad to see the place back in full swing. It’s a real hub for the community so be sure to come by for a swim or an aquafit session. https://t.co/cRBeMr1BTL",NA,NA,NA,NA,NA,NA,NA,NA,NA,NA,NA,NA
"text817467.2","We must challenge the stigma that stops so many people asking for help.","DanCardenMP",1489313108850094080,"2022-02-03T19:01:29Z","Last year, I spoke about my own experiences with my mental health, addiction and being in recovery.

We must challenge the stigma that stops so many people asking for help.

#TimeToTalk #MentalHealthMatters 

https://t.co/K44p7m5fW5",NA,NA,NA,NA,NA,NA,NA,NA,NA,NA,NA,NA
"text408764.1","and here is the incredibly moving video from @HarryRFrancis that I mentioned https://t.co/jGB7VLR7ko","OfficialALW",1274793712808312832,"2020-06-21T19:58:00Z","and here is the incredibly moving video from @HarryRFrancis that I mentioned https://t.co/jGB7VLR7ko",NA,NA,NA,NA,NA,NA,NA,NA,NA,NA,NA,NA
"text1176507.2","No 1 issue raised by parents at Oliver Goldsmiths School this morning.","HarrietHarman",1202543604398514176,"2019-12-05T11:01:52Z","Housing, housing, housing!  No 1 issue raised by parents at Oliver Goldsmiths School this morning.  They want &amp; need a @UKLabour govt. Thanks to @Jason_Ochere &amp; @stgileslabour for joining me #GE2019 https://t.co/ZWebkOPZ0a",NA,NA,NA,NA,NA,NA,NA,NA,NA,NA,NA,NA
"text956280.1","Brilliant to sing along to the """"Lambeth Walk"""" with everyone.","SamanthaDixonMP",742007275557130240,"2016-06-12T14:54:54Z","Brilliant to sing along to the """"Lambeth Walk"""" with everyone. Thanks to all for coming to support QEII birthday event https://t.co/FXpLtYcsL3",NA,NA,NA,NA,NA,NA,NA,NA,NA,NA,NA,NA
"text768419.1","🎅 CHRISTMAS CARDS 🎄   I asked two keen children to design me a Christmas Card.","paulbristow79",1594620721166163968,"2022-11-21T09:16:21Z","🎅 CHRISTMAS CARDS 🎄 

I asked two keen children to design me a Christmas Card.  They have been pushing me to let them do it for about 12 months - since last year’s Christmas card competition 🎄

Well my 2 and 7 yr old daughters have come up with the following.…

Proud Daddy! https://t.co/bkQu49c0yP",NA,NA,NA,NA,NA,NA,NA,NA,NA,NA,NA,NA
"text1198636.2","Of course farming must decarbonise &amp; farmers have set themselves very ambitious targets for doing so.","JSHeappey",1199598462553264128,"2019-11-27T07:58:55Z","This is very true. Of course farming must decarbonise &amp; farmers have set themselves very ambitious targets for doing so. But arguing against meat consumption isn’t way forward. Meat &amp; dairy is BIG part of Somerset economy &amp; important part of healthy balanced diet too. 🌳🥩🧀🐄🌳",NA,NA,NA,NA,NA,NA,NA,NA,NA,NA,NA,NA
"text1375089.2","Helping tackle Covid backlogs, ambulance waiting times and improve GP access.","BrandonLewis",1593213302024605696,"2022-11-17T12:03:46Z","RT @Conservatives: 🩺 NEW: NHS funding will increase. Helping tackle Covid backlogs, ambulance waiting times and improve GP access.  

#Autu…",NA,NA,NA,NA,NA,NA,NA,NA,NA,NA,NA,NA
"text1766386.2","This is disappointing news, particularly as they previously reversed a decision to close in 2018, instead opting for reduced hours.","hammersmithandy",1463861299046232064,"2021-11-25T13:25:05Z","Natwest has informed me they plan to close their Shepherds Bush branch on the 23rd March 2022. This is disappointing news, particularly as they previously reversed a decision to close in 2018, instead opting for reduced hours. (1/3) 🧵",NA,NA,NA,NA,NA,NA,NA,NA,NA,NA,NA,NA
"text701475.2","I share the disappointment that more projects in Leeds and West Yorkshire were not successful.","StuartAndrew",1618974457443524608,"2023-01-27T14:09:24Z","Round 2 of the Levelling Up Fund was announced this week, and I welcome that the West Yorkshire Combined Authority were awarded over £40m to improve bus services across our area. I share the disappointment that more projects in Leeds and West Yorkshire were not successful.",NA,NA,NA,NA,NA,NA,NA,NA,NA,NA,NA,NA
"text1408519.2","These pledges won’t tackle cost of living scandal, NHS crisis &amp; climate emergency - but a general election will, so let’s have one  Me for @MetroUK 👇  https://t.co/wMCzCeWdeO","CarolineLucas",1613605054405017600,"2023-01-12T18:33:18Z","Rishi Sunak making five pledges is courageous, considering this Tory Govt's record on breaking promises. These pledges won’t tackle cost of living scandal, NHS crisis &amp; climate emergency - but a general election will, so let’s have one

Me for @MetroUK 👇

https://t.co/wMCzCeWdeO",NA,NA,NA,NA,NA,NA,NA,NA,NA,NA,NA,NA
"text729793.1","Why is the Prime Minister still in office when she is no longer in power?","hilarybennmp",1582090925689696256,"2022-10-17T19:27:25Z","Why is the Prime Minister still in office when she is no longer in power? https://t.co/6qEJoOhmCp",NA,NA,NA,NA,NA,NA,NA,NA,NA,NA,NA,NA
"text1014705.2","They are settling into their  new buildings well following the disruption caused by Covid.","CliveEfford",1505880294045405184,"2022-03-21T12:13:34Z","It was a pleasure to visit to Leigh Academy Blackheath secondary school. They are settling into their  new buildings well following the disruption caused by Covid. It was great to hear the aspirations of the pupils I met. Certainly setting themselves high standards. https://t.co/p96dXzTjZp",NA,NA,NA,NA,NA,NA,NA,NA,NA,NA,NA,NA
"text376252.3","My mother always felt strongly it was the Nazis who were to blame.","Dannythefink",1659884347023933440,"2023-05-20T11:30:42Z","@SBuschova I think it’s complicated in Holland at least. But without doubt some decisions were taken that were moral and strategic errors. My mother always felt strongly it was the Nazis who were to blame. The book comes on June 8th.",NA,NA,NA,NA,NA,NA,NA,NA,NA,NA,NA,NA
"text806728.2","The Governments latest announcements are too little, too late &amp; still leave leaseholders facing life-changing bills.","RuthCadbury",1535224368824999936,"2022-06-10T11:36:27Z","The Building Safety crisis has had a huge impact on so many people in Hounslow.

The Governments latest announcements are too little, too late &amp; still leave leaseholders facing life-changing bills.

Watch part of my speech yesterday 👇 https://t.co/GeZhUZ5U1k",NA,NA,NA,NA,NA,NA,NA,NA,NA,NA,NA,NA
"text38099.1","Best wishes to the brilliant achievers@wow_bradford this Sunday you are making a huge difference #womenmatter #shecan #youngambassadors","Baroness_Verma",793051030237904896,"2016-10-31T11:24:34Z","Best wishes to the brilliant achievers@wow_bradford this Sunday you are making a huge difference #womenmatter #shecan #youngambassadors",NA,NA,NA,NA,NA,NA,NA,NA,NA,NA,NA,NA
"text1522015.2","We need a Green New Deal to:  - Root the transition in good, unionised jobs  - Tackle inequalities of wealth and power  - Build public infrastructure for every community to benefit from","Ed_Miliband",1384501024279318528,"2021-04-20T13:35:41Z","(3) We need to recognise that we cannot put a green coat of paint on the old, unfair economy. We need a Green New Deal to:

- Root the transition in good, unionised jobs

- Tackle inequalities of wealth and power

- Build public infrastructure for every community to benefit from",NA,NA,NA,NA,NA,NA,NA,NA,NA,NA,NA,NA
"text60304.1","Trist clywed am farw Maldwyn Lewis Porthmadog, yn 94 mlwydd oed.","Dafydd_Wigley",1380781283056484352,"2021-04-10T07:14:46Z","Trist clywed am farw Maldwyn Lewis Porthmadog, yn 94 mlwydd oed. Bu'n un o'r hoelion wyth a osododd seiliau i Grŵp Plaid Cymru ar Gyngor Gwynedd o 1973 ymlaen. Bu'n asiant etholiad hynod i mi ym 1979 a 1983. Atgofion dwys wrth gyd-alaru a Dewi,  Geraint a Gwenith  a r teulu oll.",NA,NA,NA,NA,NA,NA,NA,NA,NA,NA,NA,NA
"text1323210.1","Royal Mail attribute delays to:  - COVID-19 related absenences (running at ca. 20%)  - a massive increase in parcel delivery  - the need to prioritise home COVID-19 tests  There are around 90 delivery offices effected nationwide.","Afzal4Gorton",1480919116529684480,"2022-01-11T15:06:46Z","Royal Mail attribute delays to:

- COVID-19 related absenences (running at ca. 20%) 
- a massive increase in parcel delivery 
- the need to prioritise home COVID-19 tests

There are around 90 delivery offices effected nationwide. 

(3/5)",NA,NA,NA,NA,NA,NA,NA,NA,NA,NA,NA,NA
"text607487.1","Fabulous response for @MichaelPayneUK &amp; Pauline Allan in Arnold North for the @NottsCC elections, they are your local labour champions.","Vernon_Coaker",1380222252147412992,"2021-04-08T18:13:22Z","Fabulous response for @MichaelPayneUK &amp; Pauline Allan in Arnold North for the @NottsCC elections, they are your local labour champions. It was great to welcome @NickTorfaen to snowy #gedling",NA,NA,NA,NA,NA,NA,NA,NA,NA,NA,NA,NA
"text947024.2","Innovation has always been at the heart of #transport, but Government must ensure that it does not come at the cost of passengers and workers’ safety. https://t.co/Cldh2PzEWC","TanDhesi",1599808110218350592,"2022-12-05T16:49:11Z","#GuidedTransportModes new technology can revolutionise railways, bus lanes, tramways and roads via the use of #sensors.

Innovation has always been at the heart of #transport, but Government must ensure that it does not come at the cost of passengers and workers’ safety. https://t.co/Cldh2PzEWC",NA,NA,NA,NA,NA,NA,NA,NA,NA,NA,NA,NA
"text935428.3","I’d also say do as much research as you can about your university to make sure it’s the best fit for you!","DehennaDavison",1380162582682726400,"2021-04-08T14:16:16Z","Q: What’s some advice you would give to someone applying to uni?

A: Spend a lot of time on your personal statement as it can be a key factor on whether you’ll get an offer. I’d also say do as much research as you can about your university to make sure it’s the best fit for you!",NA,NA,NA,NA,NA,NA,NA,NA,NA,NA,NA,NA
"text802564.3","Your experience matters – head to https://t.co/ffgvHelwhX to complete the #BrainSurvey now.","liambyrnemp",1576956054662889472,"2022-10-03T15:23:16Z","Neurological conditions are the biggest cause of disabilities in the world. @TheBrainCharity wants to hear from you about your diagnosis experience. 

Your experience matters – head to https://t.co/ffgvHelwhX to complete the #BrainSurvey now. ⤵️ ⤵️",NA,NA,NA,NA,NA,NA,NA,NA,NA,NA,NA,NA
"text1135438.2","Yet women are forced to wait until their 3rd loss before receiving any care or su…","LilianGreenwood",1542835749892104192,"2022-07-01T11:41:21Z","RT @_OliviaBlake: 1 in 4 pregnancies end is miscarriage.

Yet women are forced to wait until their 3rd loss before receiving any care or su…",NA,NA,NA,NA,NA,NA,NA,NA,NA,NA,NA,NA
"text1859549.2","And I had the best leafletting squad along with me today, which always helps 😀 https://t.co/qzHztPJHh8","RThomsonMP",1388897446697242624,"2021-05-02T16:45:30Z","So the weather might not have been great while campaigning for @GillianMar2021 this afternoon in Aberdeenshire East, but the future's a bright one if we make it #BothVotesSNP on Thursday. And I had the best leafletting squad along with me today, which always helps 😀 https://t.co/qzHztPJHh8",NA,NA,NA,NA,NA,NA,NA,NA,NA,NA,NA,NA
"text251071.2","👑  Handel’s ‘Zadok the Priest’ in a supermarket flashmob. https://t…","ArleneFosterUK",1656009574749536256,"2023-05-09T18:53:44Z","RT @ClassicFM: The coronation classic that everyone is talking about... 👑

Handel’s ‘Zadok the Priest’ in a supermarket flashmob. https://t…",NA,NA,NA,NA,NA,NA,NA,NA,NA,NA,NA,NA
"text1924107.2","Thank you to everyone who came to support Rishi in last night’s hustings  🗳Voting closes at 5pm tomorrow so cast your…","Helen_Whately",1565274276210642944,"2022-09-01T09:44:03Z","RT @Ready4Rishi: Wow! Thank you to everyone who came to support Rishi in last night’s hustings

🗳Voting closes at 5pm tomorrow so cast your…",NA,NA,NA,NA,NA,NA,NA,NA,NA,NA,NA,NA
"text1387711.2","There's a powerful stench of sleaze surrounding the Tory government.","DavidLinden",1385171119137775616,"2021-04-22T09:58:24Z","RT @Ianblackford_MP: Nicola Sturgeon is right. There's a powerful stench of sleaze surrounding the Tory government.

Tory friends and donor…",NA,NA,NA,NA,NA,NA,NA,NA,NA,NA,NA,NA
"text1480925.1","@GLAChristina @MhairiHunter You mean you’ve bothered to get out of bed?","Stuart_McDonald",1332631406607032320,"2020-11-28T10:24:21Z","@GLAChristina @MhairiHunter You mean you’ve bothered to get out of bed?",NA,NA,NA,NA,NA,NA,NA,NA,NA,NA,NA,NA
"text1280788.1","An honour to speak at the @oxukrainesummit yesterday. 2023 is the hinge of fate.","BorisJohnson",1635724192267243520,"2023-03-14T19:26:52Z","An honour to speak at the @oxukrainesummit yesterday. 2023 is the hinge of fate. Ukraine needs our continued support.  They need more equipment, and they need it now. #ukrainemustwin 🇺🇦 https://t.co/b1KwRCGobx",NA,NA,NA,NA,NA,NA,NA,NA,NA,NA,NA,NA
"text940733.2","My statement on today’s Autumn Budget ✍🏾   92% of Battersea constituents who completed my cost-of-living survey don’t believe the government is doing enough.","MarshadeCordova",1593348277004636160,"2022-11-17T21:00:06Z","1. My statement on today’s Autumn Budget ✍🏾 

92% of Battersea constituents who completed my cost-of-living survey don’t believe the government is doing enough. The public have lost confidence in the Tory’s handling of the economy. https://t.co/lbpIII7tGe",NA,NA,NA,NA,NA,NA,NA,NA,NA,NA,NA,NA
"text132340.1","BBC daily politics FARAGE on again,it's just unacceptable our licence fee is abused on a daily basis by the nutcases running the corporation","davegoddardsk2",877131609459306496,"2017-06-20T11:50:46Z","BBC daily politics FARAGE on again,it's just unacceptable our licence fee is abused on a daily basis by the nutcases running the corporation",NA,NA,NA,NA,NA,NA,NA,NA,NA,NA,NA,NA
"text1769407.1","In just three days, the evictions ban will be lifted, meaning thousands are at risk of losing their homes.","CatSmithMP",1296505839679942656,"2020-08-20T17:54:14Z","In just three days, the evictions ban will be lifted, meaning thousands are at risk of losing their homes.

The Government must extend the ban.
https://t.co/tWsmyac9oM",NA,NA,NA,NA,NA,NA,NA,NA,NA,NA,NA,NA
"text623223.1","@dolse_co A historic moment like Non League Stockport County getting to the FA cup second round today beating Rochale away 2-1","GoddardLord",1325124478968369152,"2020-11-07T17:14:30Z","@dolse_co A historic moment like Non League Stockport County getting to the FA cup second round today beating Rochale away 2-1",NA,NA,NA,NA,NA,NA,NA,NA,NA,NA,NA,NA
"text282404.1","Many congratulations to Rose Hudson-Wilkin on her appointment as the new Bishop of Dover @churchofengland","lordnickbourne",1146688346665541632,"2019-07-04T07:53:00Z","Many congratulations to Rose Hudson-Wilkin on her appointment as the new Bishop of Dover @churchofengland",NA,NA,NA,NA,NA,NA,NA,NA,NA,NA,NA,NA
"text1654710.1","Thank you everyone who attended my coffee morning in Doxford.","bphillipsonMP",1489994895930634240,"2022-02-05T16:10:40Z","Thank you everyone who attended my coffee morning in Doxford. 

Crime &amp; anti-social behaviour are a major concern locally, but police officers are more stretched than ever. 

Labour’s plan would mean new neighbourhood prevention teams to tackle anti-social behaviour at source. https://t.co/YIlkWYI1B8",NA,NA,NA,NA,NA,NA,NA,NA,NA,NA,NA,NA
"text485792.2","😀 all welcome to our public meeting featuring @SSalyers2, @CrossgateCentre  and Alex Salmond @AlbaParty…","AlbaParty",1545359320350605312,"2022-07-08T10:49:08Z","RT @AlbaFife: Tonight's the night! 😀 all welcome to our public meeting featuring @SSalyers2, @CrossgateCentre
 and Alex Salmond @AlbaParty…",NA,NA,NA,NA,NA,NA,NA,NA,NA,NA,NA,NA
"text239521.1","With thanks to @SOAS students who campaigned to make this a reality https://t.co/NYVX4CWzvM","ValerieAmos",960971132391346176,"2018-02-06T20:19:06Z","With thanks to @SOAS students who campaigned to make this a reality https://t.co/NYVX4CWzvM",NA,NA,NA,NA,NA,NA,NA,NA,NA,NA,NA,NA
"text889617.1","Congratulations to the newly elected @thesnp Councillor @grantyferguson  for #EK Central North 💛👏🏻 #SNP #SNPwin","AngelaCrawley30",1167207085953769472,"2019-08-29T22:47:09Z","Congratulations to the newly elected @thesnp Councillor @grantyferguson  for #EK Central North 💛👏🏻 #SNP #SNPwin",NA,NA,NA,NA,NA,NA,NA,NA,NA,NA,NA,NA
"text594686.2","My Essay for GIS Reports •Society is digitizing at breakneck speed •Feelings of loneliness and exclusion are rising •Some tools are ripe for misuse by governments and bad actors https://t.co/yorGiScxHZ","DavidAltonHL",1598807423732654080,"2022-12-02T22:32:48Z","Where will technologization leave humanity? My Essay for GIS Reports •Society is digitizing at breakneck speed
•Feelings of loneliness and exclusion are rising •Some tools are ripe for misuse by governments and bad actors https://t.co/yorGiScxHZ",NA,NA,NA,NA,NA,NA,NA,NA,NA,NA,NA,NA
"text354588.2","Admittedly they are not Government appointments but there is no """"process"""" seeking balance.","HowardDLeigh",1310120768253112320,"2020-09-27T07:35:06Z","@DAaronovitch Ok. Noted on that but I am told by those who have looked in to this that there is only one college led by a Tory. Admittedly they are not Government appointments but there is no """"process"""" seeking balance.",NA,NA,NA,NA,NA,NA,NA,NA,NA,NA,NA,NA
"text844093.1","Excellent article by @PreetKGillMP about preventable diseases on #worldhealthday Much more needs to be done to address health inequalities!","BambosMP",982632042990063616,"2018-04-07T14:51:50Z","Excellent article by @PreetKGillMP about preventable diseases on #worldhealthday Much more needs to be done to address health inequalities!  https://t.co/LBiOtLcktP",NA,NA,NA,NA,NA,NA,NA,NA,NA,NA,NA,NA
"text633798.1","Here’s a report on the @10DowningStreet Pride reception and some of the inspiring people I was privileged to meet there https://t.co/AzSTBfk0Qj","nickherbertcbe",1410242107286167552,"2021-06-30T14:21:34Z","Here’s a report on the @10DowningStreet Pride reception and some of the inspiring people I was privileged to meet there https://t.co/AzSTBfk0Qj",NA,NA,NA,NA,NA,NA,NA,NA,NA,NA,NA,NA
"text1401147.1","One of the great pleasures of this week has been to meet the new Scottish Conservative MPs including the lovely Bill Grant MP @ScotTories https://t.co/777OdcEIRo","JuliaLopezMP",875303086922895360,"2017-06-15T10:44:52Z","One of the great pleasures of this week has been to meet the new Scottish Conservative MPs including the lovely Bill Grant MP @ScotTories https://t.co/777OdcEIRo",NA,NA,NA,NA,NA,NA,NA,NA,NA,NA,NA,NA
"text1771903.1","Today’s jobs figures are worrying including for young people looking for work.","NorwichChloe",1293161409803620352,"2020-08-11T12:24:40Z","Today’s jobs figures are worrying including for young people looking for work. Norwich For Jobs will continue to help Norwich young people find a chance. We encourage local firms to get involved and use the new schemes

You can read my blog here: https://t.co/2DOCHSEoJn",NA,NA,NA,NA,NA,NA,NA,NA,NA,NA,NA,NA
"text1812969.2","That's why green hydrogen is so essential –it's the destination all hydrogen must get to if 🇬🇧 is to meet our #NetZero goal.  https://t.co/uTGJ3G3lfL","Alex_Stafford",1367418541033615360,"2021-03-04T10:16:00Z","Hydrogen is the alternative to electrification for those hard-to-decarbonise sectors like heavy-duty transport and home heating. 

That's why green hydrogen is so essential –it's the destination all hydrogen must get to if 🇬🇧 is to meet our #NetZero goal.

https://t.co/uTGJ3G3lfL",NA,NA,NA,NA,NA,NA,NA,NA,NA,NA,NA,NA
"text892111.1","Whatever you think of NI Protocol, extraordinary Government claiming can rewrite their own domestic laws to supercede international agreement.","stellacreasy",1536626488514162688,"2022-06-14T08:27:58Z","Whatever you think of NI Protocol, extraordinary Government claiming can rewrite their own domestic laws to supercede international agreement. When we take part in World Cup, I'd like us to write a rule that England doesn't have to do penalty shootouts and Brazil have to hop..😉",NA,NA,NA,NA,NA,NA,NA,NA,NA,NA,NA,NA
"text277921.2","We face an unknown, an unknowable, future; that means that every single course of action we take, every commitment, has its underside of doubt.","rabbisacks",1298980852316028928,"2020-08-27T13:49:03Z","…everything, but there is one thing we will never know: what tomorrow will bring. We face an unknown, an unknowable, future; that means that every single course of action we take, every commitment, has its underside of doubt.",NA,NA,NA,NA,NA,NA,NA,NA,NA,NA,NA,NA
"text1480720.2","If not, then there must at least be cooperation so we can reduce the risks  of re-seeding of Covid or the introduction of new strains into Scotland.","Stuart_McDonald",1356629895426752512,"2021-02-02T15:45:46Z","An important move to introduce comprehensive managed quarantine, and one which should be replicated by the UK government. 

If not, then there must at least be cooperation so we can reduce the risks  of re-seeding of Covid or the introduction of new strains into Scotland.",NA,NA,NA,NA,NA,NA,NA,NA,NA,NA,NA,NA
"text990461.2","I haven’t taken a position against equality for same sex couples as I explained very frankly to pink news.","JackieDP",1253079199159595008,"2020-04-22T21:52:16Z","@AdrianHarrop @AllianceLGB You are wrong. I haven’t taken a position against equality for same sex couples as I explained very frankly to pink news. I have a very consistent view that the state should ensure equality for all couples before the law through civil unions &amp; what churches do is for them.",NA,NA,NA,NA,NA,NA,NA,NA,NA,NA,NA,NA
"text1504771.2","A devoted public servant, Betty was at the forefront of a generation of women who s…","AnnaMcMorrin",1641086915830075392,"2023-03-29T14:36:25Z","RT @Keir_Starmer: Betty Boothroyd was an inspiration. 

A devoted public servant, Betty was at the forefront of a generation of women who s…",NA,NA,NA,NA,NA,NA,NA,NA,NA,NA,NA,NA
"text912418.2","It’s stylish, radical, excellent quality and as tea towels go, HUGE.","AshleyDalton_MP",1182074974154174464,"2019-10-09T23:26:50Z","Rather thrilled with the ⁦@radicalteatowel⁩ Rose Parks tea towel I won in the ⁦@SouthHackneyLab⁩ raffle tonight. It’s stylish, radical, excellent quality and as tea towels go, HUGE. Normally I re-donate raffle wins to the next raffle but I’m keeping this one. https://t.co/ZdidlPptTU",NA,NA,NA,NA,NA,NA,NA,NA,NA,NA,NA,NA
"text1447669.2","The Government has now launched an easy-access portal for us to be able to do this in Hertford &amp; Stortford, however we can.  https://t.co/5OL4ueMCSj","JulieMarsonMP",1430099248767553536,"2021-08-24T09:26:45Z","I've been overwhelmed by the generosity of all those residents who have contacted me to offer their support to Afghan refugees.

The Government has now launched an easy-access portal for us to be able to do this in Hertford &amp; Stortford, however we can.

https://t.co/5OL4ueMCSj",NA,NA,NA,NA,NA,NA,NA,NA,NA,NA,NA,NA
"text1200741.1","So many people were inspired by my colleague Tobias Ellwood and the members of the public who have first aid in... https://t.co/rlrGIm1v8H","JSHeappey",846793866854436864,"2017-03-28T18:39:25Z","So many people were inspired by my colleague Tobias Ellwood and the members of the public who have first aid in... https://t.co/rlrGIm1v8H",NA,NA,NA,NA,NA,NA,NA,NA,NA,NA,NA,NA
"text1729962.1","Beautiful sky in #Barnstaple this evening https://t.co/jhXlZBpPVh","SelaineSaxby",1456673452430176256,"2021-11-05T17:23:09Z","Beautiful sky in #Barnstaple this evening https://t.co/jhXlZBpPVh",NA,NA,NA,NA,NA,NA,NA,NA,NA,NA,NA,NA
