"doc_id","text","pol_account","id","date","context","issue","policy_flag","stance","annotator","annotated_at","selected_at","uncertainty","not_sentence","draft_flag","issue2","uncertainty2","stance2"
"text1162618.1","My latest community email is now out, with an update on some fantastic local charities, the latest Coronavirus advice including the easing of restrictions, and more: https://t.co/MnThwfj3mM https://t.co/ZcmZrFLaOl","S_Hammond",1272507003584352256,"2020-06-15T12:31:26Z","My latest community email is now out, with an update on some fantastic local charities, the latest Coronavirus advice including the easing of restrictions, and more: https://t.co/MnThwfj3mM https://t.co/ZcmZrFLaOl",NA,NA,NA,NA,NA,NA,NA,NA,NA,NA,NA,NA
"text1674982.1","@trappedonanisl1 More a case of it was the right thing to do - as virtually anybody else would recognise.","VotePursglove",1346190081443459072,"2021-01-04T20:21:41Z","@trappedonanisl1 More a case of it was the right thing to do - as virtually anybody else would recognise. And I help local people on all manner of issues and concerns day in, day out. The churlishness is exhausting, frankly.",NA,NA,NA,NA,NA,NA,NA,NA,NA,NA,NA,NA
"text1605062.2","This is a further 3.2 million dragged into paying the basic rate, in addition to 2.6 million pushed into higher rate tax.","sarahjolney1",1597247648700198912,"2022-11-28T15:14:49Z","For context, the total number of people who will be forced into a higher income tax band by the Chancellor's proposals is almost 6 million.

This is a further 3.2 million dragged into paying the basic rate, in addition to 2.6 million pushed into higher rate tax.",NA,NA,NA,NA,NA,NA,NA,NA,NA,NA,NA,NA
"text1410264.3","It's not a line he can apologise away and he should not be at that dispatch box","CarolineLucas",1516734480429596672,"2022-04-20T11:04:14Z","Outraged watching @borisjohnson at #PMQs when he should've resigned. He's crossed line after line, including breaking the law - a law he made and we followed. It's not a line he can apologise away and he should not be at that dispatch box",NA,NA,NA,NA,NA,NA,NA,NA,NA,NA,NA,NA
"text660915.3","Tories chose to - cut taxes for the rich, destroy public services, austerity, destroy the NHS, contracts for cronies,  deny food to hungry, cut pensions.","premnsikka",1581282119963541504,"2022-10-15T13:53:30Z","Jeremy Hunt says difficult decisions ahead after Truss ‘mistakes’.

Rubbish ... they were policy.

Tories chose to - cut taxes for the rich, destroy public services, austerity, destroy the NHS, contracts for cronies,  deny food to hungry, cut pensions.

We can't forget/forgive.",NA,NA,NA,NA,NA,NA,NA,NA,NA,NA,NA,NA
"text815717.2","One of 5 sets of 3 brothers from Tynemouth Borough killed in WW1. http://t.co/6PZB6H3983","alancampbellmp",609721921077440512,"2015-06-13T14:00:08Z","Ernest, Arthur and George Carr from Eleanor St. One of 5 sets of 3 brothers from Tynemouth Borough killed in WW1. http://t.co/6PZB6H3983",NA,NA,NA,NA,NA,NA,NA,NA,NA,NA,NA,NA
"text650971.2","You seem to have missed the fact that we have left the EU as a supreme act of democracy.","danielmgmoylan",1613291269945544704,"2023-01-11T21:46:26Z","@RadarRadar @dmcfender You’re the one sounding stupid. You seem to have missed the fact that we have left the EU as a supreme act of democracy. That means we aren’t in it any more. We have a relationship with the EU akin to that enjoyed by hundreds of other normal countries, including customs controls.",NA,NA,NA,NA,NA,NA,NA,NA,NA,NA,NA,NA
"text409999.2","Hope you have a wonderful day and Easter ☺️🎉🎶🎈🎂 From all of us at #TeamALW.","OfficialALW",712276084583112704,"2016-03-22T13:53:46Z","@billiepsi thank you Guillermo! Hope you have a wonderful day and Easter ☺️🎉🎶🎈🎂 From all of us at #TeamALW.",NA,NA,NA,NA,NA,NA,NA,NA,NA,NA,NA,NA
"text1112291.1","Had the Bank of England not intervened, there would have been mass insolvencies of pension funds by THIS AFTERNOON.","PreetKGillMP",1575135826266263552,"2022-09-28T14:50:20Z","Had the Bank of England not intervened, there would have been mass insolvencies of pension funds by THIS AFTERNOON. @Keir_Starmer is right recall parliament now.",NA,NA,NA,NA,NA,NA,NA,NA,NA,NA,NA,NA
"text871701.1","Delighted to be celebrating #InternationalWomensDay at the #March4Women.","jeremycorbyn",1236705053454536704,"2020-03-08T17:27:16Z","Delighted to be celebrating #InternationalWomensDay at the #March4Women.

Today we remember the hard-won victories achieved by generations of women and recommit ourselves to continuing the struggle for gender equality in our country and around the world. https://t.co/YwsGv6trLY",NA,NA,NA,NA,NA,NA,NA,NA,NA,NA,NA,NA
"text393728.3","This @Policy_Exchange report from @Robert_WH_Ede is so important.","JimBethell",1526488240227864576,"2022-05-17T09:02:11Z","🇬🇧 expertise in cutting-edge specialised services demonstrates #NHS at its most innovative. 
But its huge success means tough decisions if we are to benefit from these advances. 
This @Policy_Exchange report from @Robert_WH_Ede is so important. Read it! 

https://t.co/ZEKUGLK98M",NA,NA,NA,NA,NA,NA,NA,NA,NA,NA,NA,NA
"text524744.2","This is a unique opportunity for the UK to deepen our 80 year strong relationship with our North Atlantic neighbour over the coming decade 🇬🇧🇮🇸","DominicRaab",1260950149788061696,"2020-05-14T15:08:37Z","Today @morton_wendy and @GudlaugurThor signed the Iceland and UK Joint Vision for 2030. 

This is a unique opportunity for the UK to deepen our 80 year strong relationship with our North Atlantic neighbour over the coming decade 🇬🇧🇮🇸",NA,NA,NA,NA,NA,NA,NA,NA,NA,NA,NA,NA
"text994690.2","Have been doing interviews on latest migrant crossing deaths in the Channel since this morning.","RosieDuffield1",1603035794549395456,"2022-12-14T14:34:51Z","Relieved that we just won that vote. Have been doing interviews on latest migrant crossing deaths in the Channel since this morning. Those humans are more than just the latest statistics and one death in the icy channel is one too many...",NA,NA,NA,NA,NA,NA,NA,NA,NA,NA,NA,NA
"text266942.1","@davidbogle1 Yes but in TM's deal GB-EU alignment in certain areas was accepted as the price for no border GB-NI and in BJ's deal it wasn't","GavinBarwell",1489900358151376896,"2022-02-05T09:55:01Z","@davidbogle1 Yes but in TM's deal GB-EU alignment in certain areas was accepted as the price for no border GB-NI and in BJ's deal it wasn't",NA,NA,NA,NA,NA,NA,NA,NA,NA,NA,NA,NA
"text540569.1","@Finias This is not true if staff or any constituents contact me I will indeed help email Michelle.donelan.mp@parliament.uk","michelledonelan",999015096415375360,"2018-05-22T19:52:14Z","@Finias This is not true if staff or any constituents contact me I will indeed help email Michelle.donelan.mp@parliament.uk",NA,NA,NA,NA,NA,NA,NA,NA,NA,NA,NA,NA
"text523189.1","When the UK's #COP26 Presidency began, only 30% of the world's economy was covered by net zero targets.","DominicRaab",1418543886096535552,"2021-07-23T12:09:52Z","When the UK's #COP26 Presidency began, only 30% of the world's economy was covered by net zero targets. Now over 70% is. With 100 days until #COP26, the UK is working to secure more commitments, to reduce global emissions, protect the most vulnerable and tackle #ClimateChange.",NA,NA,NA,NA,NA,NA,NA,NA,NA,NA,NA,NA
"text1045299.1","@sixiefan It’s kind of not up to us, it’s up to Tory MPs and the voters - so we continue to support the government when it’s right and challenge it in the national interest where we feel (eg over oligarchs) it’s not going far enough.","timfarron",1500473076659761152,"2022-03-06T14:07:13Z","@sixiefan It’s kind of not up to us, it’s up to Tory MPs and the voters - so we continue to support the government when it’s right and challenge it in the national interest where we feel (eg over oligarchs) it’s not going far enough. Johnson going has nothing to do with war tactics.",NA,NA,NA,NA,NA,NA,NA,NA,NA,NA,NA,NA
"text1213389.1","Delighted to support Schools Together Partnerships tonight which has brought together schools from the Independent and State  sector for the best of our children’s eduction. ⁦","Wera_Hobhouse",1465431725845143552,"2021-11-29T21:25:24Z","Delighted to support Schools Together Partnerships tonight which has brought together schools from the Independent and State  sector for the best of our children’s eduction. ⁦@MonktonBath⁩

Looking forward to Bath Schools Choir performing at Bath Festivals next year. https://t.co/aONGsb3fYa",NA,NA,NA,NA,NA,NA,NA,NA,NA,NA,NA,NA
"text285489.1","@patrickhart10 I don't have the same edition in office - email me questions@jeffreyarcher.co.uk","Jeffrey_Archer",380631933828354048,"2013-09-19T09:58:19Z","@patrickhart10 I don't have the same edition in office - email me questions@jeffreyarcher.co.uk",NA,NA,NA,NA,NA,NA,NA,NA,NA,NA,NA,NA
"text1427847.1","@AngelaRayner @PutneyFleur @FloEshalomi Errr, Christmas in Hollis and Stop the cavalry, after that I’m struggling to be honest.Merry Christmas!!!","justinmadders",1606610324815114240,"2022-12-24T11:18:45Z","@AngelaRayner @PutneyFleur @FloEshalomi Errr, Christmas in Hollis and Stop the cavalry, after that I’m struggling to be honest.Merry Christmas!!!☃️❄️⛄️",NA,NA,NA,NA,NA,NA,NA,NA,NA,NA,NA,NA
"text1093347.1","Great to catch up with @HuddlestonNigel and the team from @svrofficialsite with the @HeritageFundUK today in Kidderminster.","Mark4WyreForest",1314567075864686592,"2020-10-09T14:03:09Z","Great to catch up with @HuddlestonNigel and the team from @svrofficialsite with the @HeritageFundUK today in Kidderminster. The SVR has just been awarded £900K  Incredibly welcome news https://t.co/QB51VXeci5",NA,NA,NA,NA,NA,NA,NA,NA,NA,NA,NA,NA
"text94854.1","Such typically British weather - can rely on rain on great occasions.","LPNorthover",733054578934054912,"2016-05-18T22:00:05Z","Such typically British weather - can rely on rain on great occasions. Good thing the Queen's carriage has a cover... https://t.co/JtgWkRhiFQ",NA,NA,NA,NA,NA,NA,NA,NA,NA,NA,NA,NA
"text1453429.2","It is so damaging to the environment and is one of the reasons we experience flooding.","RachaelMaskell",1212875036291477504,"2020-01-02T23:15:17Z","I will continue to raise this in Parliament. It is so damaging to the environment and is one of the reasons we experience flooding.",NA,NA,NA,NA,NA,NA,NA,NA,NA,NA,NA,NA
"text230917.1","@stephenfry @ChapterCatcher Thank you for making tonight's @ChapterCatcher launch so indescribably wonderful, Stephen 💛","johnbirdswords",1139284993195356160,"2019-06-13T21:34:43Z","@stephenfry @ChapterCatcher Thank you for making tonight's @ChapterCatcher launch so indescribably wonderful, Stephen 💛",NA,NA,NA,NA,NA,NA,NA,NA,NA,NA,NA,NA
"text1917083.2","So many talented musicians ⁦@HaringeyYMusic⁩ https://t.co/D1XTW5oF6B","CatherineWest1",1543699825518075904,"2022-07-03T20:54:53Z","Delightful to be back ⁦@HornseySchool⁩ this evening for a wonderful concert of big band and piano concerto, flute soloist. So many talented musicians ⁦@HaringeyYMusic⁩ https://t.co/D1XTW5oF6B",NA,NA,NA,NA,NA,NA,NA,NA,NA,NA,NA,NA
"text871056.2","I don't believe the measures are what is needed to drive down the levels of the virus.","jeremycorbyn",1333861812673138688,"2020-12-01T19:53:32Z","I voted against the Government's proposals tonight. 

I don't believe the measures are what is needed to drive down the levels of the virus.

The financial support packages being offered are inadequate, inconsistent and unfair to many areas.",NA,NA,NA,NA,NA,NA,NA,NA,NA,NA,NA,NA
"text481702.2","Thank you to all the volunteers without whom this would never happen 😘 https://t.co/TedbJCihO4","LordPeterHendy",1166673121149095936,"2019-08-28T11:25:22Z","RT @ImberbusUK: Wow! Thank you to all the volunteers without whom this would never happen 😘
https://t.co/TedbJCihO4",NA,NA,NA,NA,NA,NA,NA,NA,NA,NA,NA,NA
"text351678.1","Here is how the @LibDems are already delivering on what Labour are proposing #strongereconomy #FairerSociety http://t.co/7Exm1yIOoi","TheDon_Foster",484767842337050624,"2014-07-03T18:37:14Z","Here is how the @LibDems are already delivering on what Labour are proposing #strongereconomy #FairerSociety http://t.co/7Exm1yIOoi",NA,NA,NA,NA,NA,NA,NA,NA,NA,NA,NA,NA
"text1139898.1","Government unveils taskforce chair to boost older people's housing https://t.co/cILv99fcO5","griffitha",1643470483462017024,"2023-04-05T04:27:52Z","Government unveils taskforce chair to boost older people's housing https://t.co/cILv99fcO5",NA,NA,NA,NA,NA,NA,NA,NA,NA,NA,NA,NA
"text1353209.1","2/2 Roy demonstrated an interactive project using augmented reality to help empower patients in relation to Denture Treatment.","Pauline_Latham",1105126995493642240,"2019-03-11T15:23:02Z","2/2 Roy demonstrated an interactive project using augmented reality to help empower patients in relation to Denture Treatment. Well done Roy, for your very impressive project! And good luck in your finals!",NA,NA,NA,NA,NA,NA,NA,NA,NA,NA,NA,NA
"text849106.2","I look forward to working with PM to deliver @Conservatives ambitious agenda in 2019 manifesto, which I campaigned for across 🇬🇧 with colleagues https://t.co/87EtI0RGWu","Rehman_Chishti",1307985278955593728,"2020-09-21T10:09:26Z","As per letter, my resignation on point of principle over policy difference does not affect my admiration &amp; respect for @BorisJohnson. I look forward to working with PM to deliver @Conservatives ambitious agenda in 2019 manifesto, which I campaigned for across 🇬🇧 with colleagues https://t.co/87EtI0RGWu",NA,NA,NA,NA,NA,NA,NA,NA,NA,NA,NA,NA
"text1231716.1","@lancew Data isn’t shared but you can use for other purposes in contacting those people.","pauljholmes",1547960967471833088,"2022-07-15T15:07:09Z","@lancew Data isn’t shared but you can use for other purposes in contacting those people.",NA,NA,NA,NA,NA,NA,NA,NA,NA,NA,NA,NA
"text1950437.1","That ws probably the most right wing financial statement we have heard since Thatcher.","PeteWishart",1573235834798723072,"2022-09-23T09:00:26Z","That ws probably the most right wing financial statement we have heard since Thatcher. God help us…..",NA,NA,NA,NA,NA,NA,NA,NA,NA,NA,NA,NA
"text1548685.1","Pop in to say hello at the next Pint with your MP on Sunday 29 January at The Stag, Fratton.","StephenMorganMP",1614348391936397312,"2023-01-14T19:47:04Z","Pop in to say hello at the next Pint with your MP on Sunday 29 January at The Stag, Fratton. Come along for a chat over a pint or lemonade! Booking essential👇🏻
https://t.co/yyYPjgeTcy https://t.co/hxExBYEx0G",NA,NA,NA,NA,NA,NA,NA,NA,NA,NA,NA,NA
"text1692016.1","Any A level student unhappy about their grade should appeal or sit the exam.","johnredwood",1294538836836528128,"2020-08-15T07:38:04Z","Any A level student unhappy about their grade should appeal or sit the exam. Glad schools can help students provide evidence needed to get an upgrade where there is a good case.",NA,NA,NA,NA,NA,NA,NA,NA,NA,NA,NA,NA
"text1064088.1","@LeaValleyGrower @PRSD @KevinFoster The Seasonal Agricultural Workers visa was 6 months pre-brexit, the core is it meant to be seasonal, not residential in the UK, there are some other temporary routes which don't carry settlement rights, eg Youth Mobility, with varying lengths, all carry the IHS requirement.","kevin_j_foster",1629864718558015488,"2023-02-26T15:23:24Z","@LeaValleyGrower @PRSD @KevinFoster The Seasonal Agricultural Workers visa was 6 months pre-brexit, the core is it meant to be seasonal, not residential in the UK, there are some other temporary routes which don't carry settlement rights, eg Youth Mobility, with varying lengths, all carry the IHS requirement.",NA,NA,NA,NA,NA,NA,NA,NA,NA,NA,NA,NA
"text1412546.2","Natural Flood Management is essential in Calderdale and they do it so well.","HollyLynch5",1429542545827237888,"2021-08-22T20:34:37Z","Loved being out with @slowtheflow_UK this morning with their volunteers and a lovely bunch from @infostaugs. Natural Flood Management is essential in Calderdale and they do it so well. Stuffing gullies and building leaky dams today. https://t.co/H9ADL5McDH",NA,NA,NA,NA,NA,NA,NA,NA,NA,NA,NA,NA
"text445962.1","Good thread on the eco-vandalism of @EalingCouncil and why they need voting out at the first opportunity.","GreenJennyJones",1634036873348751360,"2023-03-10T03:42:04Z","Good thread on the eco-vandalism of @EalingCouncil and why they need voting out at the first opportunity.",NA,NA,NA,NA,NA,NA,NA,NA,NA,NA,NA,NA
"text1000895.2","S Shrops GP practices will release details of their accelerated vaccination programme soon.","Dunne4Ludlow",1470315333361745920,"2021-12-13T08:51:07Z","Please do NOT call your GP practice to inquire about booster appointments. S Shrops GP practices will release details of their accelerated vaccination programme soon. NHS Booking System now open for 30+ to ring 61 days from second vaccine to get your booster dose from 91 days.",NA,NA,NA,NA,NA,NA,NA,NA,NA,NA,NA,NA
"text593413.1","Iran: “Frightening” number of executions as UN Human Rights Chief Volker Türk  calls for end to death penalty | In recent days there has been a staggering &amp; truly shocking rise in executions in Iran  https://t.co/5jFETA8MGx","DavidAltonHL",1656665313658937344,"2023-05-11T14:19:24Z","Iran: “Frightening” number of executions as UN Human Rights Chief Volker Türk  calls for end to death penalty | In recent days there has been a staggering &amp; truly shocking rise in executions in Iran  https://t.co/5jFETA8MGx",NA,NA,NA,NA,NA,NA,NA,NA,NA,NA,NA,NA
"text421759.2","Just look at what is actually the smallest portion of where our tax goes!","lordtev",963508807082168320,"2018-02-13T20:22:55Z","RT @polbikers: Just had my annual tax statement. Just look at what is actually the smallest portion of where our tax goes!

And these are H…",NA,NA,NA,NA,NA,NA,NA,NA,NA,NA,NA,NA
"text632157.3","A Labour government would close loopholes in the Hunting Act to protect British wildlife.  https://t.co/z8dMvvbLM0","SueHayman1",1108377630401798144,"2019-03-20T14:39:54Z","In the #WildlifeCrime debate now. Hearing evidence on how the Hunting Act needs to be strengthened. 

A Labour government would close loopholes in the Hunting Act to protect British wildlife.

https://t.co/z8dMvvbLM0",NA,NA,NA,NA,NA,NA,NA,NA,NA,NA,NA,NA
"text765632.2","I have been pushing for more police resources to ensure the fraudsters and scammers are brought to justice.","ABridgen",1491388639330578432,"2022-02-09T12:28:54Z","Fraud is the fastest growing crime, damaging individuals and businesses. I have been pushing for more police resources to ensure the fraudsters and scammers are brought to justice.",NA,NA,NA,NA,NA,NA,NA,NA,NA,NA,NA,NA
"text185608.2","We must urgently implement the recommendations from this report without delay &amp; I call on gov't to now appoint a dedicated VAWG minister.   https://t.co/N71vl9F9HS","VictimsComm",1441365312381734912,"2021-09-24T11:34:04Z","Sabina Nessa was killed the very day @HMICFRS reported that there is an epidemic of violence against women &amp; girls.

We must urgently implement the recommendations from this report without delay &amp; I call on gov't to now appoint a dedicated VAWG minister. 

https://t.co/N71vl9F9HS",NA,NA,NA,NA,NA,NA,NA,NA,NA,NA,NA,NA
"text1591094.1","Such an important subject and so much more still needs to be done","carolinenokes",1514615522918207488,"2022-04-14T14:44:15Z","Such an important subject and so much more still needs to be done",NA,NA,NA,NA,NA,NA,NA,NA,NA,NA,NA,NA
"text1276809.2","Report it on the 'Grot Spot' page on my website 👉 https://t.co/3Fqqj1Yx4O  🚮🌿 Through working with local authorities, residents and businesses, we are helping keep the Workington Constituency clean. https://t.co/eaORF7HuwO","markjenkinsonmp",1590766401287262208,"2022-11-10T18:00:39Z","🔎 Have you noticed an unattractive or untidy space in your local area? 

Report it on the 'Grot Spot' page on my website 👉 https://t.co/3Fqqj1Yx4O

🚮🌿 Through working with local authorities, residents and businesses, we are helping keep the Workington Constituency clean. https://t.co/eaORF7HuwO",NA,NA,NA,NA,NA,NA,NA,NA,NA,NA,NA,NA
"text263910.2","Very, very funny take on @Peston by @hugorifkind http://t.co/z0Z5RiCVN1","1SVN",652782191756353536,"2015-10-10T09:46:17Z","My week Robert Peston* via @thetimes.  Very, very funny take on @Peston by @hugorifkind http://t.co/z0Z5RiCVN1",NA,NA,NA,NA,NA,NA,NA,NA,NA,NA,NA,NA
"text817370.1","Every year, thousands of people die because of alcohol and many more are harmed.","DanCardenMP",1506691797455622144,"2022-03-23T17:58:12Z","Every year, thousands of people die because of alcohol and many more are harmed. These harms affect children, families, communities and society.

To understand the scale of alcohol harm, I am calling for a Dame Carol Black style review of alcohol to inform a new Alcohol Strategy.",NA,NA,NA,NA,NA,NA,NA,NA,NA,NA,NA,NA
"text674293.1","Well done Stormzy supporting students to go to university #BlackLivesMatter👩🏾‍🎓 https://t.co/CS6YN9SqaH","HackneyAbbott",1421048555901493248,"2021-07-30T10:02:32Z","Well done Stormzy supporting students to go to university #BlackLivesMatter👩🏾‍🎓 https://t.co/CS6YN9SqaH",NA,NA,NA,NA,NA,NA,NA,NA,NA,NA,NA,NA
"text1567299.1","Loving this new @poppyscotland badge  I picked up at this year's #scottishpoppyappeal London launch at Dover House tonight https://t.co/ox1mPIoDOf","DavidMundellDCT",1582094481771225088,"2022-10-17T19:41:33Z","Loving this new @poppyscotland badge  I picked up at this year's #scottishpoppyappeal London launch at Dover House tonight https://t.co/ox1mPIoDOf",NA,NA,NA,NA,NA,NA,NA,NA,NA,NA,NA,NA
"text1862716.2","Here’s a quick look at the numbers. (1/6) https://t.co/lKTdjC1L4w","EmilyThornberry",1463468797986279424,"2021-11-24T11:25:26Z","It’s early days for the government’s new Export Support Service (ESS) – the helpline set up with great fanfare last month to help businesses resolve their post-Brexit problems trading with Europe – but so far, something’s not going right. Here’s a quick look at the numbers. (1/6) https://t.co/lKTdjC1L4w",NA,NA,NA,NA,NA,NA,NA,NA,NA,NA,NA,NA
"text956101.1","@BeckyLees20 @Go_CheshireWest please join the rather long queue ;-)","SamanthaDixonMP",783788241795383296,"2016-10-05T21:57:33Z","@BeckyLees20 @Go_CheshireWest please join the rather long queue ;-)",NA,NA,NA,NA,NA,NA,NA,NA,NA,NA,NA,NA
"text1963656.1","What a brilliant day visiting Queen Elizabeth High School and Hexham Middle School with my colleague @GuyOpperman.","nadhimzahawi",1535330094096564224,"2022-06-10T18:36:34Z","What a brilliant day visiting Queen Elizabeth High School and Hexham Middle School with my colleague @GuyOpperman.
 
The school has undergone a multi-million pound rebuild, and thanks to its leadership, pupils in the area have the best possible opportunity to thrive.

👇🏽👇🏽👇🏽 https://t.co/cEuOoJxWYi",NA,NA,NA,NA,NA,NA,NA,NA,NA,NA,NA,NA
"text1244539.1","Thank you @cfoc for organising the event last night in Birmingham, celebrating the Commonwealth Games.","HuddlestonNigel",1555574758967738368,"2022-08-05T15:21:38Z","Thank you @cfoc for organising the event last night in Birmingham, celebrating the Commonwealth Games.
And a huge thank you to all activists and MPs who attended and especially @andy4wm for both speaking at the event and helping ensure the games took place in the West Midlands! https://t.co/YZ6Gi225FP",NA,NA,NA,NA,NA,NA,NA,NA,NA,NA,NA,NA
"text768302.2","🙏  This super church do this on the first Sunday of every month 💙 https://t.co/v9b6ClvYA3","paulbristow79",1609542131764400128,"2023-01-01T13:28:42Z","Great way to start 2023 with St Peters and All Souls Church supporting rough sleepers and those who need a hot meal. 🙏

This super church do this on the first Sunday of every month 💙 https://t.co/v9b6ClvYA3",NA,NA,NA,NA,NA,NA,NA,NA,NA,NA,NA,NA
"text1198469.2","Stay at home to suppress the virus thus protecting the NHS which will save lives. https://t.co/cjkVkWT9xy","JSHeappey",1241075223325073408,"2020-03-20T18:52:45Z","It’s that simple folks. Stay at home to suppress the virus thus protecting the NHS which will save lives. https://t.co/cjkVkWT9xy",NA,NA,NA,NA,NA,NA,NA,NA,NA,NA,NA,NA
"text1618776.2","If the Government believes the UK should be doing business with states which carry out acts of Genocide then they should at least have the guts to put that view on the record.","KateOsamor",1359116595965100032,"2021-02-09T12:27:02Z","It is shameful that the Government is attempting to prevent a vote on the #GenocideAmendment today. 

If the Government believes the UK should be doing business with states which carry out acts of Genocide then they should at least have the guts to put that view on the record.",NA,NA,NA,NA,NA,NA,NA,NA,NA,NA,NA,NA
"text1374847.1","🎙️ Hugely enjoyable to join @IainDale &amp; @Jacqui_Smith1 earlier to record  @forthemanypod live at the Hippodrome!","BrandonLewis",1642250427507810304,"2023-04-01T19:39:48Z","🎙️ Hugely enjoyable to join @IainDale &amp; @Jacqui_Smith1 earlier to record  @forthemanypod live at the Hippodrome! https://t.co/sqG2UouMRr",NA,NA,NA,NA,NA,NA,NA,NA,NA,NA,NA,NA
"text99026.2","Perhaps we just need the first one without cheating, lies, and Russian influence. https://t.co/E4sR3kCivC","lorddeben",1019209694005661696,"2018-07-17T13:18:21Z","Maybe we don’t need a second referendum. Perhaps we just need the first one without cheating, lies, and Russian influence. https://t.co/E4sR3kCivC",NA,NA,NA,NA,NA,NA,NA,NA,NA,NA,NA,NA
