"doc_id","text","pol_account","id","date","context","issue","policy_flag","stance","annotator","annotated_at","selected_at","uncertainty","not_sentence","draft_flag","issue2","uncertainty2","stance2"
"text1362480.2","Thanks for coming to #Batley and to everyone @BatleyRLFC @BatleySPF &amp; #BARA for such a great game.","kimleadbeater",1605671325657223168,"2022-12-21T21:07:30Z","A real pleasure to work with @TeamColostomyUK this year. Thanks for coming to #Batley and to everyone @BatleyRLFC @BatleySPF &amp; #BARA for such a great game. See you next year! Merry Christmas🎅🏻🎄#RugbyLeague🏉 #PowerOfSport",NA,NA,NA,NA,NA,NA,NA,NA,NA,NA,NA,NA
"text220935.2","So sorry I couldn’t be there but this is such an important agenda.","Baronessjenkin",1167857053156696064,"2019-08-31T17:49:53Z","@GeorgeFreemanMP @BigTentIdeas Bravo to all. So sorry I couldn’t be there but this is such an important agenda. Well done especially to @GeorgeFreemanMP and @dollytheis",NA,NA,NA,NA,NA,NA,NA,NA,NA,NA,NA,NA
"text1921169.1","Terrific news that two fine local organisations have received well deserved funding from Arts Council England @ace_national    Congratulations @MotionhouseDT and @Live_Local !","MattWestern_",1588954296300756992,"2022-11-05T18:00:00Z","Terrific news that two fine local organisations have received well deserved funding from Arts Council England @ace_national  

Congratulations @MotionhouseDT and @Live_Local !",NA,NA,NA,NA,NA,NA,NA,NA,NA,NA,NA,NA
"text212370.2","I look forward to building long lasting partnerships &amp; collaborations as we welcome Gabon to the #Commonwealth family. https://t.co/B37zDreIZ4","PScotlandCSG",1559824001370816512,"2022-08-17T08:46:36Z","Fantastic welcome to my new home, #Gabon🇬🇦, by @Officiel_MMA, @aichasanni, and High Commissioners from #Nigeria, #Cameroon &amp; #Togo, on my first official visit.

I look forward to building long lasting partnerships &amp; collaborations as we welcome Gabon to the #Commonwealth family. https://t.co/B37zDreIZ4",NA,NA,NA,NA,NA,NA,NA,NA,NA,NA,NA,NA
"text1616024.1","You have been, and I am sure always will be, a true champion for children, teachers and our wonderful schools in Greenwich","abenaopp",1524671579963146240,"2022-05-12T08:43:26Z","You have been, and I am sure always will be, a true champion for children, teachers and our wonderful schools in Greenwich",NA,NA,NA,NA,NA,NA,NA,NA,NA,NA,NA,NA
"text443282.1","@HarrietRycroft it is very fine as are many of the cotswold wool churches .","LordCourtown",409655223742128128,"2013-12-08T12:06:31Z","@HarrietRycroft it is very fine as are many of the cotswold wool churches . In laws lived in Broad Campden.",NA,NA,NA,NA,NA,NA,NA,NA,NA,NA,NA,NA
"text1168697.2","He is a true patriot and would not have taken this decision lightly.","JNHanvey",1647208823084515328,"2023-04-15T12:02:41Z","RT @AlexNeilSNP: Angus is a huge loss to the SNP. He is a true patriot and would not have taken this decision lightly. We just cannot affor…",NA,NA,NA,NA,NA,NA,NA,NA,NA,NA,NA,NA
"text506384.1","YN TORRI: Mae'r cynllun i symud 180 miliwn litr o ddŵr Cymru o Bowys i dde Lloegr yn mynd yn ei flaen.","Plaid_Cymru",1641411684106371072,"2023-03-30T12:06:56Z","YN TORRI: Mae'r cynllun i symud 180 miliwn litr o ddŵr Cymru o Bowys i dde Lloegr yn mynd yn ei flaen.

Dim ond oddeutu £5m bydd Cymru yn ei gael am y cynllun tra ein bod yn talu biliau dŵr sydd gyda'r drytaf yn y DU.

Mynnwn reolaeth lwyr dros ein dŵr er budd ein cymunedau. https://t.co/92F9aJVmGB",NA,NA,NA,NA,NA,NA,NA,NA,NA,NA,NA,NA
"text1395089.2","Landlords must freeze rents or release students from tenancies they cannot use &amp; Gov must support them in this.Please sign @HLucyloo petition here👇 https://t.co/4GSwQvihrV","RLong_Bailey",1359845434685030400,"2021-02-11T12:43:10Z","Students have been awfully treated during the pandemic &amp; shouldn't have to pay for acc they cannot live in. Landlords must freeze rents or release students from tenancies they cannot use &amp; Gov must support them in this.Please sign @HLucyloo petition here👇 https://t.co/4GSwQvihrV",NA,NA,NA,NA,NA,NA,NA,NA,NA,NA,NA,NA
"text1945057.2","Great to see so many children in lessons despite the challenges of a rising number of Covid cases across the borough.","munirawilson",1447599501175398400,"2021-10-11T16:26:30Z","I was given a comprehensive tour of @StJamesCPS by headteacher Mr Beatty. Great to see so many children in lessons despite the challenges of a rising number of Covid cases across the borough. I particularly enjoyed joining in with """"head, shoulders, knees and toes"""" https://t.co/6jgh3ZtLRZ",NA,NA,NA,NA,NA,NA,NA,NA,NA,NA,NA,NA
"text1585430.2","I am mindful that an internal investigation is currently underway, but having worked closely with @ClanIHC I am stunned at this huge lapse in judgment.","GavNewlandsSNP",1575863150359900160,"2022-09-30T15:00:27Z","To say this is disappointing is an understatement. I am mindful that an internal investigation is currently underway, but having worked closely with @ClanIHC I am stunned at this huge lapse in judgment.
Thankfully, it was swiftly reversed &amp; action taken.
https://t.co/BJnPGSarhX",NA,NA,NA,NA,NA,NA,NA,NA,NA,NA,NA,NA
"text1362599.3","The government must do more to support our NHS &amp; tackle this backlog https://t.co/1TKtEAnt2c","kimleadbeater",1592926598390763520,"2022-11-16T17:04:30Z","Thank you to @radiotherapy_uk for coming to parliament to highlight the shocking statistics on waiting times for #Radiotherapy. A third of patients in West Yorkshire are waiting more than 62 days for treatment. The government must do more to support our NHS &amp; tackle this backlog https://t.co/1TKtEAnt2c",NA,NA,NA,NA,NA,NA,NA,NA,NA,NA,NA,NA
"text563193.1","📜Read the Bill &amp; other documents here to see for yourself👇  https://t.co/xw9i459hoG","Simonhartmp",1303673643818418176,"2020-09-09T12:36:32Z","📜Read the Bill &amp; other documents here to see for yourself👇

https://t.co/xw9i459hoG",NA,NA,NA,NA,NA,NA,NA,NA,NA,NA,NA,NA
"text1911477.7","I’m told I must give you an opportunity to read and remove your libellous tweet https://t.co/0urMA8IT7X","ClaudiaWebbe",1645362377091678208,"2023-04-10T09:45:34Z","@andychippie Your tweet is libellous. There was no threat or violence. That’s not me. It was a deliberate lie. There was an appeal. No media has repeated the libel following appeal outcome. I’m told I must give you an opportunity to read and remove your libellous tweet https://t.co/0urMA8IT7X",NA,NA,NA,NA,NA,NA,NA,NA,NA,NA,NA,NA
"text1354949.2","A special thank you to East Midlands Trains for kindly providing free train tickets for them!","Pauline_Latham",441626902479265792,"2014-03-06T17:30:33Z","Had a great day with the girls. A special thank you to East Midlands Trains for kindly providing free train tickets for them! @EMTrains #IWD",NA,NA,NA,NA,NA,NA,NA,NA,NA,NA,NA,NA
"text1540346.1","Excited to be heading to spend the day with @johnleechmcr and the mighty team in @MCRLibDems @AprilPreston_ @RosieHughesMcr @JohnCameronMcr @AlanGoodLD and many more.","LaylaMoran",1456268842502557696,"2021-11-04T14:35:22Z","Excited to be heading to spend the day with @johnleechmcr and the mighty team in @MCRLibDems @AprilPreston_ @RosieHughesMcr @JohnCameronMcr @AlanGoodLD and many more. See you soon!",NA,NA,NA,NA,NA,NA,NA,NA,NA,NA,NA,NA
"text1349044.1","🥌Thank you to Liz and the team for a fantastic day out at the @BorderIceRink over the festive period.","John2Win",1614185929144418304,"2023-01-14T09:01:30Z","🥌Thank you to Liz and the team for a fantastic day out at the @BorderIceRink over the festive period. 

⛸️ Pop down and give curling or skating a try this January. https://t.co/CBIApVCgOQ",NA,NA,NA,NA,NA,NA,NA,NA,NA,NA,NA,NA
"text757328.2","I seem to remember you saying this pre-2019 election and look, here we are.","BBradley_Mans",1311085156242010112,"2020-09-29T23:27:14Z","@Chrisrobertsol1 @DIGADA1 @macmillancancer @BorisJohnson Well that's a decision for you, and for the other 100,000 people in Mansfield to take in a few years time. I seem to remember you saying this pre-2019 election and look, here we are. But the joy of British democracy is you'll get another crack next time 👍",NA,NA,NA,NA,NA,NA,NA,NA,NA,NA,NA,NA
"text68516.1","Potential burdens for researchers and companies working on development of new medical devices clearly set out by @LordRennard","LizBarkerLords",1301215846862393344,"2020-09-02T17:50:07Z","Potential burdens for researchers and companies working on development of new medical devices clearly set out by @LordRennard",NA,NA,NA,NA,NA,NA,NA,NA,NA,NA,NA,NA
"text376290.1","@paolobrand I am indeed bothered and this isn’t my only tweet on it.","Dannythefink",1658858114169425920,"2023-05-17T15:32:49Z","@paolobrand I am indeed bothered and this isn’t my only tweet on it.",NA,NA,NA,NA,NA,NA,NA,NA,NA,NA,NA,NA
"text1096796.1","Popped into @HouseofCommons breakfast on Cyber Security this morning- covering data harvesting, hostile states access to critical infrastructure &amp; attracting more women &amp; men into Cyber jobs.","Nus_Ghani",1526932269063147520,"2022-05-18T14:26:36Z","Popped into @HouseofCommons breakfast on Cyber Security this morning- covering data harvesting, hostile states access to critical infrastructure &amp; attracting more women &amp; men into Cyber jobs.
Thank you @ISC2",NA,NA,NA,NA,NA,NA,NA,NA,NA,NA,NA,NA
"text1214190.1","My deepest thoughts and condolences are with Sarah Everard's family and friends at this impossibly difficult time.","Wera_Hobhouse",1402193856834191360,"2021-06-08T09:20:41Z","My deepest thoughts and condolences are with Sarah Everard's family and friends at this impossibly difficult time. 

We must not rest until there is justice for all the women who have lost to male violence. https://t.co/RumnRFqXQz",NA,NA,NA,NA,NA,NA,NA,NA,NA,NA,NA,NA
"text830875.1","@TargetTenders @CheltenhamBC Hi, if you email me about this (alex@alexchalk.com) I would be very happy to discuss further.","AlexChalkChelt",621048033111883776,"2015-07-14T20:06:04Z","@TargetTenders @CheltenhamBC Hi, if you email me about this (alex@alexchalk.com) I would be very happy to discuss further. Thx!",NA,NA,NA,NA,NA,NA,NA,NA,NA,NA,NA,NA
"text652836.2","I didn't know him when he was in the Royal Medical Corps and was sent t…","EricPickles",1248210191549706240,"2020-04-09T11:24:34Z","RT @UKHMF: “I decided to paint my stone in memory of my uncle Clem. I didn't know him when he was in the Royal Medical Corps and was sent t…",NA,NA,NA,NA,NA,NA,NA,NA,NA,NA,NA,NA
"text1773404.1","Big thanks to Mile Cross hero Darren Baker who faced down an armed robber in north Norwich https://t.co/rDhAZt7dQf @EveningNews","NorwichChloe",686884812309794816,"2016-01-12T12:17:55Z","Big thanks to Mile Cross hero Darren Baker who faced down an armed robber in north Norwich https://t.co/rDhAZt7dQf @EveningNews",NA,NA,NA,NA,NA,NA,NA,NA,NA,NA,NA,NA
"text1021132.1","Today as part of #EnglishTourismWeek I have really enjoyed my visit to the University of Northampton @UniNorthants to meet #tourism students and staff and see great work teaching tourism degrees and promoting the tourism industry in #Northampton. https://t.co/6hDsKX73g6","Michael_Ellis1",977201185454198784,"2018-03-23T15:11:32Z","Today as part of #EnglishTourismWeek I have really enjoyed my visit to the University of Northampton @UniNorthants to meet #tourism students and staff and see great work teaching tourism degrees and promoting the tourism industry in #Northampton. https://t.co/6hDsKX73g6",NA,NA,NA,NA,NA,NA,NA,NA,NA,NA,NA,NA
"text377893.1","@rthonbwooster @iMcKenzied @JohnRentoul Matthew explains rather well.","Dannythefink",1591365137025232896,"2022-11-12T09:39:49Z","@rthonbwooster @iMcKenzied @JohnRentoul Matthew explains rather well.",NA,NA,NA,NA,NA,NA,NA,NA,NA,NA,NA,NA
"text538418.1","Yet another poll showing that Penny is uniting our Party and our country behind sensible, principled Conservative values.","michelledonelan",1549065415124451328,"2022-07-18T16:15:49Z","Yet another poll showing that Penny is uniting our Party and our country behind sensible, principled Conservative values. Her dedication to serving this country in uniform and in office reminds many of us why we became Conservatives in the first place. https://t.co/rKpDVcWTY7",NA,NA,NA,NA,NA,NA,NA,NA,NA,NA,NA,NA
"text563099.2","Plaid claim that a no deal Brexit would “rip the heart out of the Welsh economy”, but will vote against a widely welcomed deal which - if voted down - would result in a no deal Brexit.","Simonhartmp",1343995951103541248,"2020-12-29T19:02:59Z","This position is illogical. 

Plaid claim that a no deal Brexit would “rip the heart out of the Welsh economy”, but will vote against a widely welcomed deal which - if voted down - would result in a no deal Brexit.

Plaid Cymru are out of touch with the people of Wales. https://t.co/btpSBUkIJW",NA,NA,NA,NA,NA,NA,NA,NA,NA,NA,NA,NA
"text1952192.1","@Dudley_College,Black Country Skills Shop and @StiltzLifts join me to discuss career and retraining opportunities.","mikejwood",1334527969411395584,"2020-12-03T16:00:36Z","@Dudley_College,Black Country Skills Shop and @StiltzLifts join me to discuss career and retraining opportunities. You can listen to our full conversation at ’Talking Dudley South with Mike Wood’ via Apple, Google Podcasts, Spotify or at: https://t.co/1YJKVXMAdz https://t.co/cHUk7gq81W",NA,NA,NA,NA,NA,NA,NA,NA,NA,NA,NA,NA
"text505169.1","Government must extend application deadline and clarify eligibility criteria for Pandemic Payment - @Farrell_Mairead and @davidcullinane  “This is the least they could do for those healthcare workers who put themselves on the front line to keep us safe.”   https://t.co/TTmltaK3Ny https://t.co/Qbvu7GBjz0","sinnfeinireland",1541483062118256640,"2022-06-27T18:06:16Z","Government must extend application deadline and clarify eligibility criteria for Pandemic Payment - @Farrell_Mairead and @davidcullinane

“This is the least they could do for those healthcare workers who put themselves on the front line to keep us safe.” 

https://t.co/TTmltaK3Ny https://t.co/Qbvu7GBjz0",NA,NA,NA,NA,NA,NA,NA,NA,NA,NA,NA,NA
"text1176443.1","‘Of course it makes me worry’: UK’s youngest MP Nadia Whittome on being a woman in Parliament | The Independent https://t.co/XJecEHEolJ","HarrietHarman",1210872089365958656,"2019-12-28T10:36:17Z","‘Of course it makes me worry’: UK’s youngest MP Nadia Whittome on being a woman in Parliament | The Independent https://t.co/XJecEHEolJ",NA,NA,NA,NA,NA,NA,NA,NA,NA,NA,NA,NA
"text1476074.3","But don’t scrap the consultation - it would be the wrong move and send the wrong message.","StewartMcDonald",1631941312420143104,"2023-03-04T08:55:03Z","I hope Humza will rethink this. If the problem here is a comms and framing issue - which seems to be the suggestion - then he undoubtedly has the ability to turn that round. But don’t scrap the consultation - it would be the wrong move and send the wrong message.",NA,NA,NA,NA,NA,NA,NA,NA,NA,NA,NA,NA
"text491752.2","Only Labour has a plan to get Britain out of this Conservative cost of living crisis. https://t.co/a4FhAbMlyQ","UKLabour",1506681683407478784,"2022-03-23T17:18:00Z","Today Rishi Sunak has shown that he is not up to the task. 
 
Only Labour has a plan to get Britain out of this Conservative cost of living crisis. https://t.co/a4FhAbMlyQ",NA,NA,NA,NA,NA,NA,NA,NA,NA,NA,NA,NA
"text377017.4","In 2008/9 we discovered we weren’t as well off as we thought we were, because what looked like long term growth…..","Dannythefink",1616376964272590848,"2023-01-20T10:07:53Z","@TheSpongeImp @George_Osborne I’d hope I would do better than that. It’s not really about blame (in my case anyway). The question is whether Labour’s higher spending on the NHS was sustainable. In 2008/9 we discovered we weren’t as well off as we thought we were, because what looked like long term growth…..",NA,NA,NA,NA,NA,NA,NA,NA,NA,NA,NA,NA
"text484420.2","🏴󠁧󠁢󠁳󠁣󠁴󠁿  📺 Watch live here👇🏽  https://t.co/UfGDh9sOtW  #ScotlandsWayForward https://t.co/F2fvhKuwrE","AlbaParty",1614265722997284864,"2023-01-14T14:18:34Z","We’re underway in Edinburgh! 🏴󠁧󠁢󠁳󠁣󠁴󠁿

📺 Watch live here👇🏽

https://t.co/UfGDh9sOtW

#ScotlandsWayForward https://t.co/F2fvhKuwrE",NA,NA,NA,NA,NA,NA,NA,NA,NA,NA,NA,NA
"text1492329.2","Not just on individuals, but the places where they live and on the economy itself.","Alison_McGovern",1592423635641597952,"2022-11-15T07:45:55Z","All our history tells of the scarring effect from people having long periods out of work. Not just on individuals, but the places where they live and on the economy itself. 

We need a better plan for real full employment. We need a general election and a @UKLabour government.",NA,NA,NA,NA,NA,NA,NA,NA,NA,NA,NA,NA
"text384798.1","Would you like to comment why I have a seat reservation @CrossCountryUK on your 10.21 Sheffield to York service but the train is so crowded that I can't even get into the carriage never mind seat.","Paulscriven",1601523848075100160,"2022-12-10T10:26:54Z","Would you like to comment why I have a seat reservation @CrossCountryUK on your 10.21 Sheffield to York service but the train is so crowded that I can't even get into the carriage never mind seat.  I have a DVT just diagnosed and am having to stand like a sardine.",NA,NA,NA,NA,NA,NA,NA,NA,NA,NA,NA,NA
"text658613.2","Yet it routinely attacks human rights and supports Tory withdrawal from ECHR.","premnsikka",1641046551320576000,"2023-03-29T11:56:01Z","Ironic that Daily Mail parent company invokes Human Rights Act to stop naming of journalists in phone-hacking case involving Prince Harry.

Yet it routinely attacks human rights and supports Tory withdrawal from ECHR.

Would it reflect? Don't count on it.
https://t.co/0I8sQqefEg",NA,NA,NA,NA,NA,NA,NA,NA,NA,NA,NA,NA
"text1140779.1","Over the next three days, I will reveal on Twitter the runners-up and winner of my Christmas Card competition!","griffitha",1471146237101498368,"2021-12-15T15:52:50Z","Over the next three days, I will reveal on Twitter the runners-up and winner of my Christmas Card competition!🎄

My Christmas Card is sent over 1,500 people, including the Prime Minister.

Today's runners-up are the fantastic entries from: Gemma, St Mary’s Pulborough

1/4🧵 https://t.co/JCc2dUEOmp",NA,NA,NA,NA,NA,NA,NA,NA,NA,NA,NA,NA
"text1720756.1","@robrouse We've checked 25 posters from owler bar to Barlow, inc millthorpe, and we have asked for 2 posters to be moved back into fields and 1 has ..","Lee4NED",872422722952982528,"2017-06-07T11:59:20Z","@robrouse We've checked 25 posters from owler bar to Barlow, inc millthorpe, and we have asked for 2 posters to be moved back into fields and 1 has ..",NA,NA,NA,NA,NA,NA,NA,NA,NA,NA,NA,NA
"text439085.3","Let’s get ready to rumble … #Tokyo2020 https://t.co/IFkX2GH0OC","sebcoe",1420800782622937088,"2021-07-29T17:37:58Z","Final prep for the No 1 ⁦@Olympics⁩ Sport.  🙏 to all the volunteers and best of luck 🥇to all our amazing and talented athletes.  Visit ⁦@WorldAthletics⁩ for all the latest reviews and previews and stories.  Let’s get ready to rumble … #Tokyo2020 https://t.co/IFkX2GH0OC",NA,NA,NA,NA,NA,NA,NA,NA,NA,NA,NA,NA
"text1165016.2","Our fantastic testing &amp; vaccination programmes have had volunteers play a vital part in their rollouts.","MattHancock",1399984847888818176,"2021-06-02T07:02:52Z","This Volunteers Week I want to say a massive thank you to all the volunteers supporting our amazing NHS. 

Our fantastic testing &amp; vaccination programmes have had volunteers play a vital part in their rollouts. The effort that these volunteers have put in will never be forgotten. https://t.co/Tsc3vQ6vlQ",NA,NA,NA,NA,NA,NA,NA,NA,NA,NA,NA,NA
"text1578915.1","1/ Today’s G7 is a crucial test of the Prime Minister’s leadership.","lisanandy",1430040739346624512,"2021-08-24T05:34:15Z","1/ Today’s G7 is a crucial test of the Prime Minister’s leadership. 

He must bring countries together, rise to the occasion and finally show real leadership on the crisis in Afghanistan. For many Afghans this could be make or break. 

This is what it needs to deliver⬇️",NA,NA,NA,NA,NA,NA,NA,NA,NA,NA,NA,NA
"text505619.1","📺 Sinn Féin spokesperson on Health @davidcullinane will be live on @TonightVMTV this evening, from 10:15pm on @VirginMedia_TV One.","sinnfeinireland",1524464358260191232,"2022-05-11T19:00:00Z","📺 Sinn Féin spokesperson on Health @davidcullinane will be live on @TonightVMTV this evening, from 10:15pm on @VirginMedia_TV One.

Watch here: https://t.co/EdU2pP8kej #TonightVMTV https://t.co/QzKZ3MbOr0",NA,NA,NA,NA,NA,NA,NA,NA,NA,NA,NA,NA
"text574270.2","Colleagues please vote for the amendment today https://t.co/dPvCAekVHN","JohnnyMercerUK",1468144082497253376,"2021-12-07T09:03:20Z","Serious support for this now - it is a no brainer.

👉less than £1m a year
👉fulfils a long standing promise
👉given their often limited resources, least we could do for those prepared to die for the Nation. 

Colleagues please vote for the amendment today https://t.co/dPvCAekVHN",NA,NA,NA,NA,NA,NA,NA,NA,NA,NA,NA,NA
"text1353304.3","I was delighted to see so many of the young people engaged &amp; enthusiastic about democracy!","Pauline_Latham",1062276932237254656,"2018-11-13T09:32:11Z","It was great to visit Asterdale Primary School last week. This was a good
opportunity to highlight UK Parliament Week.  I was delighted to see so
many of the young people engaged &amp; enthusiastic about democracy! #UKPW18 https://t.co/lT2EpqiEnY",NA,NA,NA,NA,NA,NA,NA,NA,NA,NA,NA,NA
"text722260.1","Good to visit #Pershore market with ⁦@Wychavon⁩ council leader ⁦@BradleyThomasUK⁩ to check that discretionary grants are coming through ⁦@beisgovuk⁩ #openforbusiness https://t.co/Hmg4oudLmq","hbaldwin",1274081859555725312,"2020-06-19T20:49:21Z","Good to visit #Pershore market with ⁦@Wychavon⁩ council leader ⁦@BradleyThomasUK⁩ to check that discretionary grants are coming through ⁦@beisgovuk⁩ #openforbusiness https://t.co/Hmg4oudLmq",NA,NA,NA,NA,NA,NA,NA,NA,NA,NA,NA,NA
"text1622170.1","🤩 Brilliant to be at the @CarlibarPS School Fayre this evening - so many happy faces - amazing work from the parents who put together such a fantastic event.","kirstenoswald",1537860403471990784,"2022-06-17T18:11:06Z","🤩 Brilliant to be at the @CarlibarPS School Fayre this evening - so many happy faces - amazing work from the parents who put together such a fantastic event. 👏 Also it’s always good to bump into some of our local ghostbusters! 👻 https://t.co/pHgWik4w7t",NA,NA,NA,NA,NA,NA,NA,NA,NA,NA,NA,NA
"text1068262.1","@AJPendleton @responsiblecred @UnfairDebtGroup Talking to people on the doorstep they are concerned about debt and extortionate interest rates- but it is hard to get on to that topic with other issues being the focus of the media!","Y_FovargueMP",1194329653231673344,"2019-11-12T19:02:33Z","@AJPendleton @responsiblecred @UnfairDebtGroup Talking to people on the doorstep they are concerned about debt and extortionate interest rates- but it is hard to get on to that topic with other issues being the focus of the media!",NA,NA,NA,NA,NA,NA,NA,NA,NA,NA,NA,NA
"text1437257.1","@justinmadders I’ll be voting against this disgraceful legislation on Monday.","SeemaMalhotra1",1613984893511294976,"2023-01-13T19:42:39Z","@justinmadders I’ll be voting against this disgraceful legislation on Monday. You can’t back nurses or ambulance drivers one day and then threaten to sack them the next day. There should have been negotiated solutions with Govt for disputes a long time ago.",NA,NA,NA,NA,NA,NA,NA,NA,NA,NA,NA,NA
"text1195764.1","Shameful stats out today before Christmas show homelessness rising AGAIN, including 127,000 kids stuck in temporary accommodation.","JohnHealey_MP",1207240398390939648,"2019-12-18T10:05:15Z","Shameful stats out today before Christmas show homelessness rising AGAIN, including 127,000 kids stuck in temporary accommodation.

This is what ten years of the Tories means.

There's no more powerful reminder of why Labour must rebuild to win again.

https://t.co/UNRy9utAWU",NA,NA,NA,NA,NA,NA,NA,NA,NA,NA,NA,NA
"text751040.1","Today was #EnergyDay at #COP26 ☀️🌬️🌊  From rapidly phasing out fossil fuels &amp; calling out greenwashing by big energy companies, to scaling up local &amp; community owned renewables - here is what my constituents are demanding from leaders in Glasgow!","_OliviaBlake",1456319811756060672,"2021-11-04T17:57:54Z","Today was #EnergyDay at #COP26 ☀️🌬️🌊

From rapidly phasing out fossil fuels &amp; calling out greenwashing by big energy companies, to scaling up local &amp; community owned renewables - here is what my constituents are demanding from leaders in Glasgow! #HallamClimateManifesto https://t.co/6q6tLADlZf",NA,NA,NA,NA,NA,NA,NA,NA,NA,NA,NA,NA
"text877163.1","Very positive step forward for international travel today as Govt met with industry.","robertcourts",1366736410447912960,"2021-03-02T13:05:27Z","Very positive step forward for international travel today as Govt met with industry.

We’re following the PM's roadmap: working together to safely reopen travel once current travel restrictions have been lifted. #globaltraveltaskforce 

https://t.co/bfPX6jO1U1 @transportgovuk",NA,NA,NA,NA,NA,NA,NA,NA,NA,NA,NA,NA
